<?xml version="1.0"?>
<subject 
	xmlns="http://www.w3schools.com" 
	xmlns:xsi="https://sleep-badlands-71126.herokuapp.com/bact-instance" xsi:schemaLocation="bact.xsd">
	<city>Pittsburgh</city>
	<state>PA</state>
	<gender>Male</gender>
	<marital>M</marital>
	<height>75.5</height>
	<dob>1961-12-20</dob>
	<startingweight>195.6</startingweight>
	<startingwaist>33.50</startingwaist>
	<currentdate>2016-12-12</currentdate>
	<subjectid>1</subjectid>
</subject>
<!--
Elliott Levenson
INFSCI 2560
December 12, 2016
bact.xml
XML File for handling Subject Data
Code based on example on http://www.w3schools.com/xml/schema_example.asp
-->